{
  "$schema": "http://json-schema.org/draft-07/schema#",
  "title": "StageDefinition",
  "description": "Open SimFlow stage definition schema. Stages describe research intent, evidence outputs, checks, approval triggers, and handoff guidance.",
  "type": "object",
  "required": ["name", "intent", "evidence_outputs"],
  "properties": {
    "name": {
      "type": "string",
      "description": "Stage identifier"
    },
    "id": {
      "type": "string",
      "description": "Optional stage id when different from name"
    },
    "description": {
      "type": "string",
      "description": "Human-readable stage description"
    },
    "intent": {
      "type": "string",
      "minLength": 1,
      "description": "Research intent for this stage"
    },
    "acceptable_inputs": {
      "type": "array",
      "items": {
        "oneOf": [
          {"type": "string"},
          {"type": "object", "additionalProperties": true}
        ]
      },
      "description": "Acceptable evidence or inputs; guidance only"
    },
    "evidence_outputs": {
      "type": "array",
      "minItems": 1,
      "items": {
        "oneOf": [
          {"type": "string"},
          {"type": "object", "additionalProperties": true}
        ]
      },
      "description": "Evidence artifacts expected at completion"
    },
    "recommended_skills": {
      "type": "array",
      "items": {"type": "string"},
      "description": "Recommended skills or helpers; not exclusive"
    },
    "suggested_checks": {
      "type": "array",
      "items": {"type": "string"},
      "description": "Recommended checks; not fixed validators"
    },
    "approval_triggers": {
      "type": "array",
      "items": {"type": "string"},
      "description": "Risky actions that require explicit approval"
    },
    "handoff_notes": {
      "type": "array",
      "items": {"type": "string"},
      "description": "Required handoff guidance"
    },
    "risk_notes": {
      "type": "array",
      "items": {"type": "string"},
      "description": "Common risks to surface to the host agent"
    },
    "canonical_stage": {
      "type": "string",
      "description": "Canonical top-level stage for legacy aliases"
    },
    "legacy_alias": {
      "type": "boolean",
      "description": "Whether this file is retained as a legacy stage alias"
    },
    "required_inputs": {
      "type": "array",
      "items": {"type": "string"},
      "description": "Legacy compatibility only; use acceptable_inputs for new contracts"
    },
    "expected_outputs": {
      "type": "array",
      "items": {"type": "string"},
      "description": "Legacy compatibility only; use evidence_outputs for new contracts"
    },
    "default_skill": {
      "type": "string",
      "description": "Legacy compatibility only; use recommended_skills for new contracts"
    },
    "validators": {
      "type": "array",
      "items": {"type": "string"},
      "description": "Legacy compatibility only; use suggested_checks for new contracts"
    }
  },
  "additionalProperties": true
}
