{
  "name": "{{ stage_name }}",
  "description": "{{ description }}",
  "intent": "{{ intent }}",
  "acceptable_inputs": ["{{ acceptable_input_1 }}"],
  "evidence_outputs": ["{{ evidence_output_1 }}"],
  "recommended_skills": ["{{ recommended_skill_1 }}"],
  "suggested_checks": ["{{ suggested_check_1 }}"],
  "approval_triggers": [],
  "handoff_notes": ["{{ handoff_note_1 }}"],
  "risk_notes": []
}
